{
  "version": 1,
  "registry": {
    "index_sha256": "4c1676acbd8c1164d900161605b60da5b04503e633620230185254a7beff7d61",
    "index_url": "https://github.com/jolars/datamonger/releases/download/registry-2026.09/index.json",
    "release": "2026.09",
    "schema_version": 1
  },
  "dataset": {
    "source": "uci",
    "name": "iris",
    "version": "1"
  },
  "verification": "decoded"
}
